Title,Category,Cause,How_to_Fix,Example_Before,Example_After,Notes
BootstrapMethodError,JVM Bootstrap Errors,Invalid method references during class bootstrapping.,Validate and debug bootstrap method configurations.,DynamicLinker.link(invalidBootstrap);,Ensure valid bootstrap configurations and libraries.,Occurs in advanced JVM internals.
NoSuchFieldError,Linking Error,Referencing a missing field in a class.,Validate field availability before operations.,obj.missingField;,Compile code with matching runtime classes and dependencies.,Raised when field mismatches occur.
ThreadDeath,Thread Lifecycle,A thread was forcefully stopped with Thread.stop().,Use graceful thread interruption instead of stop().,thread.stop();,Replace stop() with interruption-based lifecycle management.,Raised when deprecated lifecycle methods are used.
NoSuchAlgorithmException,Cryptography,The requested cryptographic algorithm is not available.,Use a supported algorithm or ensure availability of the algorithm.,"Cipher.getInstance(""NonExistentAlgorithm"");","Cipher.getInstance(""AES"");",Common in encryption or hashing operations.
JarException,File Handling,Errors encountered while reading or writing JAR files.,Validate JAR files before processing.,"JarFile jarFile = new JarFile(""corrupted.jar"");",Ensure the JAR file is complete and valid.,Frequently raised when dealing with archives.
LineUnavailableException,Audio,Audio line could not be opened or accessed.,Ensure proper configuration of audio systems and drivers.,audioLine.open();,Validate that audio hardware and drivers support requested operations.,Occurs during playback or audio stream manipulation.
DataTruncation,Database Access,Data was truncated during transmission or storage.,Adjust database field sizes or validate inputs.,"stmt.executeUpdate(""INSERT longText INTO VARCHAR(5));",Ensure field constraints align with data size.,Common in database operations with fixed-size fields.
PrinterAbortException,Printing,Printing job was aborted before completion.,Debug the printer service and ensure job integrity.,printJob.print();,Avoid manual interruptions and verify print settings.,Common in GUI apps with print capabilities.
StreamCorruptedException,Serialization,Streams have been corrupted during data transmission.,Validate the stream and retry reading operations.,ObjectInputStream.readObject(corruptStream);,Use proper error handling for stream recovery.,Frequently raised in serialization-based communication.
SyncFailedException,File Handling,File synchronization failed due to disk or permission issues.,Ensure proper disk permissions and validate configurations.,file.sync();,Check disk availability and retry the sync operation.,Occurs during low-level file system operations.
NoninvertibleTransformException,Graphics,Attempting to invert a non-invertible transform.,Ensure that transform matrices are invertible.,transform.inverse();,Validate and use proper mathematical transformations.,Common in graphics transformations or rendering.
ClassFormatError,JVM Loading Errors,Invalid bytecode format during class loading.,Recompile the class or validate its bytecode.,"ClassLoader.defineClass(""InvalidClass"");",Use properly compiled and valid class files.,Common in applications with dynamic loading of compiled classes.
UncaughtException,Thread Handling,An exception was thrown in a thread but not caught.,Add a default uncaught exception handler.,thread.start();,Use Thread.setDefaultUncaughtExceptionHandler() for managing errors.,Raised in multi-threaded applications.
IllegalAccessError,Runtime Linking Errors,Attempting to access private or protected members.,Adjust access modifiers or ensure proper encapsulation.,object.privateMethod();,Align access modifiers with visibility requirements.,Occurs when linking against an incompatible library.
IllegalComponentStateException,GUI Components,Invoking methods on GUI components in an invalid state.,Validate component state before performing operations.,button.setText(null);,Ensure buttons are properly initialized before manipulation.,Common in GUI applications with improper UI manipulation.
UnsupportedFlavorException,Clipboard Handling,Unsupported data format in clipboard operations.,Verify clipboard data format compatibility.,clipboard.getData(invalidFlavor);,Use supported clipboard data formats for operations.,Common in drag-and-drop or clipboard-based functionality.
OutOfMemoryError: GC Overhead Limit,JVM Memory Management,Garbage collector runs excessively without freeing memory.,Optimize memory usage or increase heap size.,ArrayList largeList = new ArrayList<>(Integer.MAX_VALUE);,Use memory-efficient data structures and algorithms.,Common in applications with poor memory management.
CodeCacheOverflowError,JVM Code Caching,JVM code cache exceeded its allocated size.,Increase code cache size using JVM flags.,Dynamic method calls in JIT compiler.,Use JVM options like -XX:ReservedCodeCacheSize to adjust limits.,Rarely occurs in highly dynamic applications.
ClassCircularityError,Class Loading,Circular references between classes during loading.,Refactor code to remove circular dependencies.,ClassA -> ClassB -> ClassA,Avoid mutual dependencies or circular relationships between classes.,Common in poorly designed dependency structures.
FactoryConfigurationError,Framework Initialization,Issues with factory configuration during framework startup.,Debug factory class and ensure proper configurations.,FactoryClass.getFactoryInstance(null);,Use valid factory settings or initialize defaults.,"Common in XML, database, and library frameworks."
